user,tweetid,timestamp,content
AkioHoshi,900662870219792385,1503569736,日経電子版の記事がエストニアのICO検討、COMSA、The DAOの例を紹介。  「仮想通貨」は法律で使われる用語として定着しましたが、ICOもニュースメディアでは一般的な用語になりそうです。
succuub,899747850338406401,1503351578,Vote for the #WINGS platform - future of the DAO. https://strawpoll.com/ed6x8s2c  @wingsplatform @ethfinex
knsmr,899594028479520770,1503314904,まだ日本ではスマートコントラクトをゴリゴリ書いてる人は少ないと思うけど画面を見せてもらって驚いた。EthereumにはRails+ CircleCIみたいにスケルトンはけるツールもテスト環境もある。チェーンを自動生成してテストも走る。TheDao以降の開発環境の充実半端ないそう
chainalysis,898226634947534853,1502988892,#Cybercrime revenue on Ethereum has doubled since The DAO. >10% of ICO funds now lies in the hands of cybercriminals 
bitstein,897820412662300672,1502892041,Old news. @VitalikButerin made that switch as soon as the DAO got hacked. 
veterantraveler,897807106765713408,1502888869,"Sunrise and sunset are just nature's way of saying, ""forgiveness and renewal"" --Gander The Dao of Dog   Enjoying dawn on Michigan Lake. "
coindesk,895676830564233216,1502380971,"4/ In context, @Coinbase's raise would only be the 4th highest earning ICO, trailing Tezos, Bancor and The DAO "
danrobinson,895406346874564608,1502316483,Just realized this post warning about reentrancy 10 months before the DAO hack was written by @socrates1024
knsmr,892775343500558336,1501689203,日本発ICOプラットフォーム登場： 1. 法定通貨ペグでボラ下げる 2. 3種（BTC/NEM/ETH）の仮想通貨チェーン 3. 国内の仮想通貨法に準拠 4. TheDAOのようなトラブル時のチェーン切り離し（シャットダウン）可能
coindesk,892034027691102210,1501512460,The Simplest Way to Understand Why The DAO Was a Security http://bit.ly/2hgSsem 
brianchoffman,891171935962267648,1501306921,SEC lets the DAO off the hook for fucking people but @Free_Ross goes to jail for life. pic.twitter.com/vkkwfwmPCe
BourseetTrading,890660466816675840,1501184977,".@SEC_Investor_Ed Ruling on the #DAO and #ICO, Explained #blockchain #fintech #defstar5 #makeyourownlane #Mpgvip  https://cointelegraph.com/explained/sec-ruling-on-the-dao-and-ico-explained …"
Cointelegraph,890658038906048512,1501184398,#SEC’s Verdict On the #DAO: What It Means for Token Sales https://goo.gl/rQjgX6  #Bitcoin #cryptocurrency
sarahjeong,890590710340005888,1501168346,"The SEC says that the DAO token sale last year violated securities laws, implies many ICOs do too "
coindesk,890550935663112193,1501158863,The DAO Report: Understanding the Risk of SEC Enforcement http://bit.ly/2uFcGS4 
NickSzabo4,890321836990316544,1501104241,"SEC tl;dr: TheDAO broke our regs like crazy, but we aren't going to do anything about it except write words to scare other people."
sonmdevelopment,890242103384694784,1501085232,SEC investigates the DAO token sale case https://goo.gl/FGPbNb  #blockchain #cryptocurrency #ethereum #ico
hirosetakao,890090226512781314,1501049021,なお、The DAOは、たしかスイス籍のICOであり、アメリカのSECがそれに対して訴追しているのは、いかに米国SECがパワフルであるか？　を誇示する行為とみなすべき。SECの考えでは、外国籍の企業でも、米国民にICOを販売したら、訴追の対象になります。
hirosetakao,890089652664889344,1501048884,ただし、今回のSECの判断は、破たんしたThe DAOだけに適用され、ICOすべてに関して「これらはすべて有価証券だ」と言っているのではありません。
colingplatt,890087394816479232,1501048346,"Pro-tip, don't describe your ""not a security"" as a security in a recorded conference, the SEC has YouTube too. #theDAO "
Richtopia,890020974258794498,1501032510,SEC Report About The DAO ICO Being A Security Is Good News For The Community @BrianDEvans https://www.inc.com/brian-d-evans/sec-report-about-the-dao-ico-being-a-security-is-g.html … via @Inc
avsa,890003074722521090,1501028243,The SEC's DAO report is actually a fascinating and very throughout history and description of the DAO—but the conclusion isn't a surprise. 
el33th4xor,889978928273772545,1501022486,"SEC's ruling on The DAO is quite specific, and applies pointedly to, well, DAO-like investment funds. Not to all ICOs by a long shot."
CollinCrypto,889969187296358401,1501020163,Did anyone truly think the $DAO wasn't a security?
muneeb,889964733234909184,1501019101,It'll be hard to write a history of crypto economics without a dedicated chapter on the DAO.
valkenburgh,889953523726766081,1501016429,"SEC says TheDAO Tokens were securities, as I suggested a year ago: https://soundcloud.com/arthurfalls/the-ether-review-32-peter-van#t=33:00 … but important questions remain."
a_ferron,889950500245966849,1501015708,"Ethereum Foundation lawyers, S. Tual and SlockIt team right now. #SECCrackdown #ICO #TheDAO "
avsa,888051292526055424,1500562901,"The DAO Bug, unlike Parity Wallet Bug: 1) Stolen funds couldn't be moved 2) ""Salvaged"" funds were still at risk 3) much larger % of ether"
WhalePanda,887778550245462017,1500497875,"Also a good lesson to remember from the $DAO hack is that the ""white hat hackers"" tried to dump a part of the coins they ""saved"". $ETH"
brianchoffman,887771765686104065,1500496257,"So someone who knew a lot about Ethereum, the DAO, solidity and then a ton about Parity is hacking. That profile has to fit thousands."
CollinCrypto,887757494998749185,1500492855,#Ethereum set a rollback precedent w/ the DAO. Now we just argue the $ threshold.  Does a $32M + $10M hack combo qualify for hardfork? $ETH
alexsunnarborg,887651614206681092,1500467611,What % of current ether holders do you think know what The DAO was?
gavinandresen,887288653902467072,1500381074,Yep. But I still don't understand why people think ETC might have long-term value. Has the DAO hacker cashed out yet? 
WeRateBitcoiner,883148009973792768,1499393868,Meet @gavofyork. A Turin Complete Vitalik. Wrote most of the initial Ethereum code. Never part of $TheDAO. Wishes for a time machine. 14/10 
leiphone_com,879378350854348800,1498495111,彭博社深度还原The DAO大劫案始末：过去已过去，未来仍需创造 http://ift.tt/2s9pNNl  http://ift.tt/2rkdtsy 
TuurDemeester,878783020081135617,1498353173,"So TheDAO bailout returned 3.6M ETH to the investors, now worth $1 billion. Total amount raised in ICOs since: +/- $1 billion... "
dionyziz,877893362019205120,1498141062,"The technical details of the DAO hazard presented by @el33th4xor, the white hat hacker who found the million $ bug first, one year later."
Bancor,877876014130409474,1498136926,#Bancor responds to recent criticism by @udiWertheimer and restates learnings from #theDAO and support for #ethereum
WhalePanda,877484586716016640,1498043603,Remember that post of the guy putting all his savings in the $DAO? This is similar... but then $ETH.
SatoshiLite,877440286384947200,1498033040,Current ICO craze is out of control because people never learned their lesson with TheDAO after everyone got bailed out. Disaster incoming.
wadakooo,877169516244946944,1497968484,僕個人が今まで手を出したICOはThe DAOだけで、その結果は言うまでもなく・・・ なのでそれ以来ICOには手を出してません・・・
el33th4xor,876097119643471872,1497712805,"A year ago today, The DAO was hacked. Today, it's not even a blip on the charts, thanks to a fantastic community. "
crypto_dev_alex,876095232323993600,1497712355,"The DAO: how far we've come and how far we have yet to go.  Stay positive, contribute what you can, and don't forget to enjoy the ride  "
amachino,875925409270947841,1497671866,最近いろんな方から ICO について聞かれることがあったので、The DAO 事件の１周年に合わせて解説記事を書いてみました。主に資金調達手法の観点からまとめてます。  思ったより長くなってしまった。。
jackfru1t,874649470327287809,1497367658,"Must read, well-researched piece on the DAO debacle from last year.  https://www.bloomberg.com/features/2017-the-ether-thief/ …"
IOHK_Charles,874629036596748288,1497362786,Great article on the DAO Hack https://www.bloomberg.com/features/2017-the-ether-thief/ … @el33th4xor
IOHK_Charles,874450661852762112,1497320258,"""Everybody Won"" thoughts on the outcome of the DAO Fork "
wmougayar,874348391639261188,1497295875,Congrats to @BancorNetwork for re-igniting fears of hype and greed in token sales & automagically stopping once the DAO record was eclipsed.
lopp,874303759949721600,1497285234,"Looks like @BancorNetwork is bigger than The DAO, having already raised over $150M today. Good luck to all involved."
Bancor,874197445730861056,1497259887,"We just published ""Learning from the DAO"", how @BancorNetwork thinks about #security on #ethereum #blockchain https://goo.gl/aDvh8G "
VitalikButerin,873068988535775233,1496990842,"This also applies to ""rolling back history"" in the DAO fork. Creates mistaken impression 5 weeks of history were all deleted."
SingularDTV,872835705193607168,1496935223,“Is @SingularDTV What the DAO Should Have Been?”   #Ethereum #Blockchain #Decentralized #Entertainment #Economy  https://medium.com/@SingularDTV/is-singulardtv-what-the-dao-should-have-been-a4b159306342 …
adam3us,870959237756833794,1496487838,"Is @VitalikButerin going to make them whole? If not why not, is it ethereum founders and friends not making losses as they were in the DAO? "
ToneVays,869311791205109760,1496095056,"Great #consensus2017 Recap @WhalePanda, just want to highlight the #Ethereum PoW/PoS Cluster-Fuck which I've talked about even pre- #TheDAO pic.twitter.com/zq80nyo0KM"
rabbyte,868115021687123968,1495809724,it's one year since the TheDAO failure and a DAO governs the dot eth domain. it currently holds ~$200 million in deposits for name auctions.
brucefenton,867749093338214401,1495722480,If you held Eth before the DAO fork... your Eth Classic is now worth more than the pre split Eth.  Bitcoin take note. The market likes forks
NoTotally,867619049093513216,1495691475,"In the time since the Dao incident, I've convinced myself that all of the jokes, all of the slurs, aren't indicative of how they see us."
VinnyLingham,867224124522999808,1495597318,"So, I'm wondering, when does the price of ETC get high enough that the DAO attacker decides to start dumping it..."
qna_cn,867145991513927680,1495578689,New V2EX Q&A: 去年参加了以太坊 THE DAO 的 ICO 筹款，后来项目失败退款，今天发现还有零头没退 by boter - http://ift.tt/2qhEUyb  #问大家 #v2ex
just4v2ex,867133592652173312,1495575733,[问与答] 去年参加了以太坊 THE DAO 的 ICO 筹款，后来项目失败退款，今天发现还有零头没退: ETH 链 当时价值很低，所以剩了一点零头懒得退 刚刚把这点 DAO 的零头退款回 ETH，以当时 ICO 耗费的人民币计… http://ift.tt/2qhEUyb 
Krasner4DA,867020169704382467,1495548691,The injustice done to Shaurn Thomas underscores the need to expand the DAO's conviction review unit: http://www.philly.com/philly/blogs/attytood/Yet-another-Philly-murder-conviction-to-be-tossed-after-24-years-behind-bars.html … #Krasner4DA
alexclarkbarry,866755925369122818,1495485690,"Good quote by @naval at #consensus17 ""theDAO had a $150,000,000 bug bounty on it, bug bounty claimed!"""
CryptoYoda1338,860845079136808961,1494076435,"$ETC is the original chain, $ETH is the manipulated chain of banksters to bail out institutional investors in the DAO accident. Just saying"
MeherRoy,860158945532551168,1493912848,"During the DAO bailout, I thought it was a mistake. Time has shown it was not; I was mistaken."
wadakooo,858630736345092096,1493548494,昨年5月に開始し100億円超の資金調達をしたのち、1ヶ月経たずに頓挫となったThe DAOですが、本日付でcoincheckでの取扱がついに終了となりました。 The DAOの中身より、ハッキング後のハードフォーク騒動やDappsの安全性が注目された印象深いプロジェクトでした。 
NTmoney,857979745522204673,1493393286,The top 5 token sales in the past yr:  The DAO: $150M @cosmos_hq: $16.8M @wavesplatform : $16.4M @qtumorg : $15.6M @gnosisPM : $12.5M
eveewing,857710079960895488,1493328993,Looking forward to my next flight on Dao Airlines and to taking in a Bulls game at the Dao Center 
hudsonjameson,856487592392613888,1493037529,Mystery solved. @Humaniq_co uses stolen emails from The DAO slack for marketing. Stay far away from them @Deloitte
jbaylina,852980246856990720,1492201313,WHG withdraw contract extended. https://www.reddit.com/r/ethereum/comments/65ex5c/whg_withdraw_contract_extended/ … #ethereum #TheDAO #whitehats #etc
JstnMchl,852551347962605568,1492099055,"""Dr. Dao about to get paid. They're gonna have to rename it the Dao Jones when he gets that fat check."" - the prophet @ibzo"
3ChicsPolitico,852551209340858368,1492099022,"Dr Dao lost 2 front teeth, suffered a concussion & will undergo reconstructive surgery.  @courierjournal The Dao's should come for you too."
KS1729,852540689720233984,1492096514,title of a likely book on this whole fiasco: The Dao of United 
mombot,852134307652972544,1491999625,Update: This Dao IS the Dao! 
johnmoe,851801972705566723,1491920390,People are really eager to learn more about this guy. In other words... the Dao jones is at an all-time high. 
eth_classic,850785211608707074,1491677975,"Get your $ETC refund from ""The DAO"" before the ""White Hat Group"" claims it. "
WhalePanda,849900584526389248,1491467064,"jtoomim, $ZEC cloud mining scammer, compares Gregs proposal to fix the ASICBoost issue with the $DAO HF. Whut?"
eth_classic,849863684667179008,1491458266,"Typical $ETH user....   Is it any wonder why ""The DAO"" investors demanded a bail out? "
WeTrustPlatform,849335969832726529,1491332449,The Whitehat Withdrawal Contract distribution period is now reaching its end http://buff.ly/2ovxVVA  #Ethereum #TheDAO
ethstatus,847117479658881025,1490803520,"Issue 04, @MrYukonC interview in the #Ethereum Contributors Series! We talk about community, VR and fall of TheDAO. http://bit.ly/2oyNw2S "
happily2018,846389497000448000,1490629955,"KathNiel is the Dao Ming Si and San Chai of the PH kaya. Technically not the 1st to arrive but THEY were the ones who arrived as a ""FORCE"""
ToneVays,841500207623864320,1489464258,At around $100 / 1B MCap the #dash $DASH Masternode's honeypot becomes worthy of #theDAO style hack... & NO I DON'T need to read the WP! 
CollinCrypto,837529174893985793,1488517490,#Ethereum price is nearing an all-time-high when priced against the dollar. The previous high was made at the peak of the $DAO hype. $ETH
simondlr,837239888512704513,1488448519,Ethereum ($ETH) just surpassed it's ATH market-cap it previously reached just before #theDAO was hacked back in June 2016.
MikeQuindazzi,835014721732554752,1487917998,"150,000 #crowdfunding campaigns launched in 2016, The Dao #blockchain project @ethereumproject crushed them all at $168 million. #fintech"
jgarzik,834042118767276034,1487686111,"I'm a huge fan of DAOs. ""The DAO"" did so many things wrong that it really hurt the ""brand"" It's still a great idea in specific scenarios. "
RandyHilarski,833738415334121473,1487613702,#Bitcoin News Rebranding the DAO: The Controversial Blockchain Concept is Back 
WeTrustPlatform,833117870024388608,1487465753,"- No, not like the DAO at all. It's a ""TRUSTED"" lending circle amongst trusted associates :)"
bramcohen,824680566129766401,1485454143,"Talk on formal methods. The DAO didn't need formal methods, it needed basic competence "
knsmr,817627374162317313,1483772531,イーサリアムは米ドル、というたとえもある。ハードフォークを許容するのは中央銀行を思わせます。それで大方うまく行くのだとすると、ビットコインより遥かに大きくなる可能性があると思う。けど、TheDao崩壊後は沈みまくっている。数年後に復帰することあるのかな
socrates1024,817604361559961600,1483767044,Both Ethereum and Ethereum Classic are *both* hard forks relative to the consensus rules prior to the dao attack
iandenisjohnson,816045214234251264,1483395315,Genocide in China: my review of Tan Hecheng's The Killing Wind on the Dao County massacre. @nybooks$$
coindesk,814788184697696257,1483095615,"Bitfinex, The DAO, Gatecoin...cybersecurity and cryptocurrency tell the tale of two threats: "
coindesk,813912472935628801,1482886829,"Despite the failure of The DAO, the project helped advance the industry, says Christoph Jentzsch of Slock.it http://www.coindesk.com/a-wild-ride-the-daos-developers-on-blockchain-in-2016/ …"
masanork,813881315439185920,1482879401,Fintech分野で6位と14位をいただきました。連載としては4位を筆頭に他にもいくつも入っていて、Blockchainへの関心の高まりを実感します。The DAOの記事が入らなかったのが残念 / “2016年アクセスランキング…” 
Vindyne8,813875374723649536,1482877985,Slock.it's Christoph Jentzsch looks back at the lessons learned from The #DAO in 2016 http://www.coindesk.com/blessing-and-a-curse-the-daos-developers-on-blockchain-in-2016/ … @coindesk
marshawright,813256406061219840,1482730411,Will The $50m Heist Of The DAO Take Down Bitcoin's Rival Blo... http://bit.ly/28Q68Y1  #entrepreneur #startup
Vindyne8,812419460556582912,1482530868,#Classic and #theDAO: What Drove #Ether Prices in 2016 http://www.coindesk.com/classic-dao-drove-ether-prices-2016/ … @coindesk #ETH
SingularDTV,810735651733831680,1482129416,A detailed dive into the DAO #Ethereum #HardFork and the reasoning behind it  by @ethereumJoseph
coindesk,809745088863735808,1481893248,"The DAO hacker's controversial coding maneuvers won him, her, or they the top spot on CoinDesk's ""most influential"" http://bit.ly/2hwJztj "
WayneVaughan,809059911254429696,1481729889,Congratulations to the DAO Hacker on winning @Coindesk's 2016 Most Influential Person In Blockchain Award. http://www.coindesk.com/coindesks-influential-people-blockchain-2016/ …
ToneVays,807355481970933761,1481323521,Like how #TheFed knew exactly what the #TheDAO was unlike what we were told. Wonder how the #SEC views #Ethereum $ETH security pre-mine sale
ToneVays,806849181717561344,1481202810,My recent interview w/ @bitcoinist on #bitcoin #blockchain #segwit @coinbase & #IRS #Zcash #ethereum #TheDAO & more http://bitcoinist.com/interview-tone-vays/ …
AnselLindner,806566291939147777,1481135363,So many people lost social capital over the DAO (or at least they should have). #NeverForget #bitcoin
veterantraveler,803767756416057344,1480468141,Wisdom is... --The Dao of Dog 
ChrJentzsch,802288622418427904,1480115488,Great talking at #TEDxGraz about the story of the DAO. 
Melt_Dem,801455407101251586,1479916834,all in on the DAO hacker  http://www.coindesk.com/vote-coindesks-most-influential-blockchain-2016/?utm_source=dlvr.it&utm_medium=twitter …
CointraderGuy,798405387011715072,1479189652,World's biggest crowd-fund  #theDAO #altcoins #history
andi_staub,794424213151039489,1478240466,Interesting!  #SmartContracts and the Role of Lawyers  #blockchain #fintech #legaltech #thedao #ethereum #bitcoin  http://bit.ly/2eiOXNE 
jackfru1t,792421800881684480,1477763054,"Such a crucial area for $ETH. Bounce or die situation. ~0.0125 was the low in the panic of the $DAO attack, if that breaks, freefall."
yusuke_56,791912386739380224,1477641600,日本銀行決済機構局FinTechセンター長が、「中央銀行から見た仮想通貨」というタイトルで、デジタル通貨に対する中央銀行の個人見解、ビットコイン半減期、TheDAO、Bitfinexハッキングを解説。とても深く研究されている。 
TuurDemeester,791845379792789505,1477625624,".@barrysilbert's 10 predictions for 2017. Can confirm 7, heard from a solid source that SEC is actively looking in to #TheDAO. "
Poloniex,790235115557453824,1477241708,"The DAO ""extraBalance"" refunds have been credited as ETH deposits for customers who paid more than 1 ETH per 100 DAO during the crowdsale."
ByteballOrg,788705309414023168,1476876973,Declarative smart contracts in #Byteball help avoid another #TheDAO disaster https://bitcointalk.org/index.php?topic=1617816.0 …
veterantraveler,787177078093410304,1476512615,"""It is the eyes that speak words for  heart.""  The Dao of Dog          Goodnight Tville   #thedaoofdog"
TuurDemeester,787055683191525377,1476483672,5y survivors in Bitcoin dodged these bullets and more: - Bitcoinica - Butterfly Labs - Neo&Bee - MtGox - The Dao - Forgetting your password
jgarzik,785832938906722304,1476192147,"Kind of like ""The DAO"", where the goal is to ruin the DAO name for everyone else hacking on DAOs. "
peterktodd,785703264977358848,1476161230,"""…is the same thing as the DAO — a giant bug bounty written in Solidity which doesn't need to exist"" https://m.reddit.com/r/ethereum/comments/56v0qt/i_was_asked_to_judge_the_hackethercamp_hackathon/ … @prestonjbyrne"
el33th4xor,785657066853720064,1476150216,This write-up nails the DAO and the upcoming ICO. By @prestonjbyrne  https://www.reddit.com/r/ethereum/comments/56v0qt/i_was_asked_to_judge_the_hackethercamp_hackathon/ … #ethereum
kyletorpey,785160413092712448,1476031804,Taking the opposite approach of #TheDAO. 
laurashin,784083376932282368,1475775019,"""If code is law and your code's got bugs in it, you’re screwed” - @el33th4xor #theDAO #ethereum #smartcontracts"
maraoz,783770821500276736,1475700500,15 lines of code that could have prevented TheDAO hack
cb0day,783143424614473728,1475550917,这个22岁的程序猿可以打败比特币吗? The DAO 攻击事件紧接着，他又向一个大型投资的相关利益方发出请求：“请尽快对 Slock.it 成员进行数据挖掘！”（the DAO投资是他与公司共同启动的项目，此前该项目被认为是史上最 http://bit.ly/2cOlTBK 
alistairmilne,782630683600642048,1475428670,"Learning nothing from the DAO, investors are throwing millions @ any ICO within minutes of its launch. That's called gambling, not investing"
bitwala,780403844643717120,1474897750,@ErikVoorhees The DAO a mistake? We're still working at a frontier. An industry without explosions doesn't move forward. #bitcoin #bits16
richiela,778683635910049792,1474487620,All extrabalance $ETH from the $DAO saga has been paid out.  Finally closing the chapter to this book... @BittrexExchange
simondlr,778421975832154112,1474425236,"Big kudos to @ChrJentzsch for sharing security tips post #theDAO hack at #devcon2, and having honest humility."
beckminster,775771050487402497,1473793206,. @withoutdoing 大象无形 a Great image has no form 道隐无名 the dao has no name https://books.google.ca/books?id=V4ljCgAAQBAJ&pg=PA123&lpg=PA123&dq=%E5%A4%A7%E6%96%B9%E6%97%A0%E9%9A%85+square+has+no+corners&source=bl&ots=hmVGhPbhC1&sig=c3wZnQU7QJDpai83uSi-1QkOz10&hl=en&sa=X&ved=0ahUKEwiwtJKAgo3PAhUQyGMKHbhaBHkQ6AEIHDAA#v=onepage&q=%E5%A4%A7%E6%96%B9%E6%97%A0%E9%9A%85%20square%20has%20no%20corners&f=false …
el33th4xor,775070184381964288,1473626106,"Reminder: if you prove the code correct, you don't have to verify every code path  Why The DAO didn’t stand a chance http://cointimes.tech/2016/09/why-the-dao-didnt-stand-a-chance/ …"
coindesk,773634463838396416,1473283804,Is The DAO hacker getting away? Funds from hacked smart contract are once again on the move 
bity,773330673327345664,1473211374,Whitehat Withdrawal Contract - Final Deposit is Available https://blog.bity.com/2016/09/06/whitehat-withdrawal-contract-final-deposit-is-available/ … #ethereum #theDAO
Bitcoin,773280161781391360,1473199332,The DAO Hacker is Moving Millions http://ow.ly/J7cr504eIdX 
RandyHilarski,773280071259922432,1473199310,#Bitcoin News The DAO Hacker is Moving Millions - More than $5m worth of digital currency associated with the a... http://ow.ly/bQvj504eHI1 
ShapeShift_io,773267211469357056,1473196244,PLEASE NOTE: ShapeShift will be delisting #TheDAO and #Mintcoin in roughly an hour
el33th4xor,773060768933617665,1473147024,Cute! The DAO hacker just tipped the ETC devs.  https://gastracker.io/tx/0x38d8dda6ed65444762143215ff1c2742b8c16f312766415755661389b1a6198b …
eth_classic,772939595726159872,1473118134,"Yes. This is true. The DAO ""hacker"" has donated 1,000 $ETC. We are having discussions on how to proceed."
CryptoCoinsNews,772201154730201089,1472942076,"Apple’s Six: Bitcoin, Dogecoin, Litecoin, Ethereum, the DAO & Ripple https://www.cryptocoinsnews.com/apple-dash-dashpay/ …"
malloc8,771837739935293440,1472855431,Just wrote a short post on using @gnosisPM to mitigate security exploit risk. Focuses on #TheDAO as an example. https://blog.gnosis.pm/markets-for-security-10e3e9cc271f#.bzvslux9y …
CryptOrca,771043777527947264,1472666136,"#TheDAO as ""approved"" DEAD virtual currency @Appstore, well done guys "
LefterisJP,770908285625073664,1472633832,WH ETC Withdrawal contract is deployed: https://www.reddit.com/r/ethereum/comments/50chp0/whitehat_withdraw_contract_is_deployed_at/ … With this hopefully the last chapter of #TheDAO approaches an end. #ethereum
alexis_roussel,770715762537398272,1472587931,Whitehat Withdraw contract is deployed at 0x9f5304da62a5408416ea58a17a92611019bd5ce3 https://www.reddit.com/r/ethereum/comments/50chp0/whitehat_withdraw_contract_is_deployed_at/ … #ethereum #theDAO
