user,tweetid,timestamp,content
TAYLORBUDD19,1077601584505339904,1545755213,Being like the Dao.. Is being Christ-like...
TAYLORBUDD19,1077601484068610050,1545755189,I follow the Dao... The rest of life follows it anyway.  Whether they know it or not.
TAYLORBUDD19,1077601388274827265,1545755166,The master.. By residing in the Dao.. Sets an example for all beings.
mishiko_,1077505915819945990,1545732404,And you would think that the Dao Ming family would spend millions for a wedding gown or have an heirloom of a bridal gown. At least they added a warm touch by having Yu Sao as the dressmaker. #MGSurprise @iShanCai @IamYueyuee
FrancescoRenziA,1077298021858242561,1545682838,So the DAO can issue NFTs?   Is this inside the treasury app or is it a separate module?
tokenstate,1077295171455406080,1545682158,It was the DAO that drew me into Ethereum in 2016.  I used to be a hard core Bitcoin Maximalist until that point.  Even the DAO failed it showed what is possible building on Turing complete smart contracts.   You can build anything.
Fintechgrowth,1077244151027109888,1545669994,Q&A: STEPHAN TUAL: Founder & COO http://Slock.it  & The DAO http://dld.bz/faeQR  #THEDAO #ethereum #blockchain
daostack,1077232432607154177,1545667200,"The #GenesisDAO community blog is a proposal to write regular reports on the status and trends within the #DAO, passed and funded by the DAO itself.  https://docs.google.com/document/d/1BZ3i-82ywMx0kuAYy7fi1cjGJR6ga-hvShk8fucV87w/edit …"
practicaldao,1077130481148268544,1545642893,"The dao is the ultimate force of good, it gives generously but does not seek to profit from its generosity"
GenesisAlphaBo1,1076748427449585664,1545551804,"Genesis proposal boosted: ""DAO Heading: Anyone can make a proposal to the DAO! Click the button in the bottom right."" https://alchemy.daostack.io/#/dao/0xa3f5411cfc9eee0dd108bf0d07433b6dd99037f1/proposal/0x95a40dc3c87c85b4f7e47cab4bd6133de92a5b4ec1efd8671cadd6730618ca06 …"
practicaldao,1076562749684150277,1545507535,"It is not important what exactly the dao is, what is important is the harmony and unity it represents"
practicaldao,1076391287853596672,1545466656,"Don't take life too seriously, if you do every little bad thing will make you discontent and lead you away from the dao. Be humourous and take life how it is a simple flowing of nature over complicated by human ideas"
HarrisCountyDAO,1076253874242101248,1545433894,"Great turnout at the DAO Annual Holiday Toy Drive! Thanks to our partners at the Harris County Sheriff's Office, TAG, 3 the Harden Way Foundation and Target for making today possible! "
practicaldao,1076202045244358656,1545421537,"The dao does need to show itself to be noticed, it is subtle yet powerful, it is visible yet invisible and it is patient but productive."
koeppelmann,1076150438523793408,1545409233,This is the single project I am excited most about for the next half year. It will most likely be the biggest DAO experiment on Ethereum since “the DAO”.  Announcing the dxDAO! Starting Feb. 18th https://blog.gnosis.pm/introducing-the-dxdao-27ec4301eced … @daostack
SibylleBreunle,1076011451368833024,1545376095,...walking the dao 
DharmaProtocol,1075911232903770114,1545352202,Bitcoin is coming to Ethereum!  We're excited to be one of the DAO members for WBTC. We plan on integrating WBTC into Dharma Lever so users can trustlessly access margin lending for Bitcoin  More info here:
nivertech,1075736178958237696,1545310465,Last day of Hebrew U. CS #winterschool on #blockchains and #cryptocurrencies.  @el33th4xor talked about The DAO. 
Thoughts_Wine,1075139791916843010,1545168276,“Our second stop on the #Dão media tour was at Caminhos Cruzados. This modern mecca of wine rises out of the vineyards that surround it. The building was just completed last year though the company was started in 2012.” More #ontheblognow http://www.wine-thoughts.com/2018/12/caminhos-cruzados-crossroad-where.html?m=1 … @vinhos_dao
Justice4Sgt,1074823004322979840,1545092748,"The defendant was arrested for assaulting his girlfriend a year ago. CORRECTION the case wasn’t thrown out, which insinuates a judge did it, the dao dropped the case claiming “prosecutorial discretion.” Here’s hoping they use that discretion in 2019 to PROTECT victims."
richatmakerdao,1073661153660813313,1544815741,On December 17 @MakerDAO will have an Executive Vote to decrease the Stability Fee for $Dai from 2.5% to 0.5%.   Please join the discussion and help shape the future of the DAO:
_Kevin_Pham,1073410186709151744,1544755906,The Mt. Gox hack strengthened Bitcoin.  The DAO bailout weakened Ethereum.
_Kevin_Pham,1073408581167280128,1544755523,"Plot Twist: The DAO hacker was the hero,  Vitalik was the villian. "
coindesk,1073366787419529217,1544745558,"""I remember reading the white paper for the DAO and thinking 'if this ever is released into the wild, it's going to hit the SEC's front door in a big way.'"" -- Valerie Szczepanik of the SEC #SECatWSBA"
rouse_tanner,1072996443764473856,1544657262,This is an awesome hire and another huge loss for the DAO. 
TexasDAO,1072554772069261312,1544551959,"13 years ago, 5 great men founded the DAO Gamma chapter here at UT Austin. We are proud to be a part of such a powerful and meaningful organization! Happy Founders’ Day!! #ΔΑΩ #ΛΧΝ"
daostack,1072491193185951744,1544536801,"Interested in becoming a #GenesisDAO pollinator? Follow the steps in this tutorial video, join the conversation and become a member of the #DAO."
vakeraj,1072191700393738240,1544465396,Except the DAO hack. That was completely reversible. 
singularity_net,1072068481305206785,1544436018,One of the most challenging concepts in Crypto is that of the DAO http://bit.ly/2UafaUQ . So we ask “Which steps do we need to go through to get from decentralized organizations to Decentralized Autonomous Organizations?” Join the discussion on #AGICHAT http://bit.ly/2U9G3In 
TokenHash,1071269938185158656,1544245631,"Yeah, what she says!  Meredith Patterson on smart contracts, subjective and objective language processing, EVM, security, and The DAO hack:   https://youtu.be/rqqdFufARXA    by @maradydd"
AnselLindner,1070851236340137984,1544145804,#Ethereum maximalists actually think like this. They seem to have a lack of respect for/acceptance of adversarial conditions. It's a trend since at least the time of the DAO. 
kyletorpey,1070761008543752192,1544124292,"The $ETH price in $BTC is currently lower than it was in March 2016, before #TheDAO was launched (char via @CoinMarketCap)."
alexsunnarborg,1070743635350708224,1544120150,MakerDAO stats are both somewhat impressive & scary  ~1.44% of ALL ETH now locked up (1.5m / 103.5m ETH)  $144M worth of ETH’s $10B current mkt cap  Relatively impressive dapp usage / SoV stat  Hopefully there’s no smart contract bug tho   I'm having flashbacks of The DAO 
bisq_network,1070700105009893376,1544109772,"v0.9.0 is one of the biggest releases in Bisq's history—join tonight's call to celebrate a bit, learn more about the DAO launch and discuss what's next. Cheers!   Time: 11:15a–12:15p Pacific / 8:15p–9:15p CET  https://youtu.be/SmHRVCtoQQQ "
el33th4xor,1070273349446758400,1544008025,"That's way more credit than I deserve for what was ultimately a community decision. And I love how his hate-filled tweet perfectly emphasizes my point.  In retrospect, the DAO fork was the best thing that happened to ETH. "
MyEtherplan,1070174872607703040,1543984547,"What a fucking idiot this guys is. Just an ignorant fool. A total loser and a pseudo-intellectual. The perfect IYI.  @el33th4xor you created ETC by promoting TheDAO hard fork, you dishonest fart!! "
bvanmaarseveen,1069957383349288960,1543932693,Exciting! @hoihansie set up a game to make us ‘feel’ how the #DAO will work. Preperation is your friend! @BlockdamM #governance #blockchain #Amsterdam @meetberlage
jaredpalmer,1069951201977032704,1543931219,Don't litter raw queries around your app though. We abstract them into a DAO and only ever go through the DAO to manipulate data. Makes it easier to add more persistence layers later on too.
ercwl,1069383383661199360,1543795841,"Yes, and I think the Ethereum DAO hardfork (ETH censoring the DAO hacker, ETC choosing not to) highlights that censorship is at its core a concern resolved by ideology & coordination and not technology."
Gilbertocintro4,1068903037228466178,1543681317,"Out of respect for Bush trump ought to read the Dao; from mercy comes courage; from frugality,generosity, from humility, leadership. mercy, courage,generosity and humility ARE American values!"
_Kevin_Pham,1068690120759402497,1543630554,So is the SEC gonna go after Vitalik for supporting/promoting/advising the following illegal security offerings or is he untouchable?:  - The DAO - Augur - Omisego  - Kyber Network 
Fieldcoin,1068263007438938112,1543528722,"In 2019, @Fieldcoin will implement the DAO land acquisition protocol in Western Europe but also in stable regions like Eastern Europe, South Asia and India. In 2020, we are expecting to grow at faster pace in those regions and will implement our protocol in the American markets. "
avsa,1067452731420524544,1543335538,I have written about 30 pages telling a first person account of the DAO hack. What should I do with it? Post in Medium in multiple parts? Make available as an e-book? Just dump the whole thing in a GitHub repo? Would anyone be interested in reading it?
_Kevin_Pham,1065308453646684161,1542824302,Socialists reveal themselves in times of crisis:  - Vitalik bailing out the DAO to benefit him and his friends.  - @krakenfx threatening to steal funds from BSV hodlers to cover potential losses they incur.  - Aumury imposing centrallized checkpoints to thwart real competition.
ZJDailyMedia,1065174249428713472,1542792305,"#ChineseQuotes  ""如贤人谋之，美也，诎人而从道。如小人谋之，不美也，诎道而从人。"" The beauty in a worthy man's plans lies in bending what is human to follow the Dao. The imperfection in a small man's plans lies in bending the Dao to what is human. (via Exemplary Figures) "
jchervinsky,1063663005752311808,1542431997,"11/ That may be why today's statement *still* doesn't clearly define how the federal securities laws apply to digital assets.  The statement asks: ""when is a digital asset a security?"" The only answer it gives: ""look at the DAO Report,"" even though that was issued ~16 months ago."
HaileyLennonBTC,1063539453921124352,1542402540,The DAO report is the SEC’s version of a parents “I already told you not to do that”
jchervinsky,1060720447531171840,1541730436,"14/ I read this as the SEC laying the groundwork to prosecute ICOs directly for failure to register under the Securities Act, which they still haven't done so far (except for blatant ponzis & scams).  If you launched an ICO after the DAO Report, you might be in the line of fire."
ZastrowBradley,1060553018305765377,1541690518,"I spoke with @30Kcrypto about my thoughts on @dash_text, the power of the DAO and why I feel we can not only make a difference in VZN - but how it’s also the perfect laboratory to perfect the @dashpay value proposition."
licuende,1060120600377769984,1541587421,"A couple years ago, the Ethereum community was dreaming of creating **one** DAO, The DAO. Now, DAOs are created every hour  "
ArthurB,1059520656021237760,1541444383,"While I frown at the appropriation of common names for specific entities (""The DAO""), I must say I'm glad @blockchain has managed to capitalize on the miscarriage of English which has been the stripping of the definite article from the term.  - We use blockchain - Oh the company?"
daostack,1059082841307385857,1541340000,The #GenesisDAO is seeking proposals in a range of areas to continue to develop the alpha version of the #DAO  https://www.youtube.com/watch?v=cEBO32pXl88&feature=youtu.be …
koeppelmann,1057917575798145024,1541062179,"In January the (to my knowledge) largest DAO experiment since ""the DAO"" will start. A @daostack DAO in FULL control of a live and running trading protocol and Dapps ontop of it. #dutchX http://slow.trade "
stevanlohja,1056457760227778563,1540714132,"TheDAO was like Empire Strikes Back and now It's Return of the Jedi. It's okay to resist censorship. Join the Green Side, Join the rebellion! #TheEthereum #EthereumClassic #ETC $ETC #Crypto #Cryptonews #Blockchain #Ethereum #ETH"
peter_szilagyi,1055444154950541313,1540472470,"During the implementation of the DAO hard fork, I made a black-box test harness (hive) that could validate a multitude of Ethereum clients. Although it started as a play thing, it is becoming a standard tool. As such, I transferred it to the Ethereum org.  "
Justice4Sgt,1052741394840866817,1539828082,"Infuriating, the DAO repeatedly tells reporters “we understand” how the families feel. NO YOU DONT. If you had any idea family after family wouldn’t feel disrespected by you. Your BS meetings are for optics alone not the fams. Families serve a life sentence w/out their loved one. "
TheKeits,1051901352991965185,1539627800,"Throwback Divekick mini comic written by a five year old.  Heart warming, beautifully brought to life by the Dao twins, and Jefailey eats dirt. "
MinSuga2109,1051823814701510656,1539609314,. Hự hự  . Moe thế  . Dạo này mất máu trầm trọng luôn  . Kook đội nón xinh phát hờn   ______________  . #PCAs . #BTS . #TheGroup . @BTS_twt
MartyBent,1051479234722586626,1539527159,It seems like we can't go a week without seeing examples of people building things on top of Bitcoin that others have launched scam tokens to build in the past.   I'm pretty sure something like this was going to be the first product/company spun out of the DAO. 
mtorresmacho,1047461346219053060,1538569220,"SDG 9, SDG 17 Data and Innovation with drones makes Malawi a pioneer of using UAV and satellite images to map crops. The community and the DAO fully involved. Great visit today in Kasungo with excellent cooperation between UNICEF, WFP and FAO! "
M157q_News_RSS,1046203198657069056,1538269254,智能合约自动化审计技术浅析 http://www.freebuf.com/articles/blockchain-articles/184083.html … 前言 经过THE DAO事件、币安被盗事件，智能合约的安全性越来越受到业内关注。本文根据猎豹区块链安全专家杨文玉9月5日在星球日报P.O.D大会上的分享录 
ethstatus,1044890578964697090,1537956301,"As we #buidl the infrastructure to evolve into a #DAO, it is important to take a look at where we are now, what is currently being built, and how we can all contribute to this movement. @cryptowanderer breaks this all down in his latest post “What the DAO” "
riya_rsp16,1042858139933016064,1537471730,Someone correct me if I'm wrong. I can't remember any scene on the show that took place on the Dao Ming mansion's balcony.  So basically they built a set just for this one scene of the OTP and didn't even bother to air it?!  #MeteorGarden2018
CbntOfficial,1041634000102555648,1537179872,"Excited to announce that the #CBNT #Roadshow was very successful today, all the media partners and institutional investors are quite interested in the model of CBNT, and we talked lots about the future of media and also about how to make a balance on the #DAO and #centralization."
r_a_salvatore,1041323829283512320,1537105922,The Dao of Drizzt? 
asglidden,1039630472626593792,1536702194,Guys...we already knew ICOs were subject to securities laws. This is not the first court order. Does *no one* remember the DAO Report?
matt_odell,1038759971754835969,1536494651,"The 2017 pump wouldn't have been nearly as large if the idiots who sent their money to the DAO lost it all rather than getting bailed out.  They didn't learn their lesson then, and it has finally caught up with them. Unfortunately retail got burned along the way. "
QWQiao,1038475402153521157,1536426804,"Still believe that the DAO is one of the very few underrated things in crypto.  If you think about it, a firm is just a set of contracts. And the ability to cheaply enforce contracts that transcend borders is incredibly powerful. "
MajorAkhill,1038060307132936192,1536327838,"#EkSaathiAurBhiTha  This is the Dao of Ao. It went for the heads during the #kargilwar  Who was the Officer, who led these Headhunters called the Nagas?  Meet him in my programme on @AkashvaniAIR FM Rainbow. Sunday, 09 Sep, 3 PM.  (Mark the date on the pic)  @adgpi @shashidigital"
willwarren89,1037094705626996736,1536097620,"10) DAOs are one of the most compelling use cases for Ethereum. We shouldn't be scared of DAOs just because ""the DAO"" was a dumpster fire. The idea of allowing a community to allocate capital for their collective benefit is insanely interesting."
daostack,1037058971692134400,1536089101,Alchemy is a tool for decentralized fund management and the first collaborative #Dapp built on the #DAO stack:
TheWinerist,1036977393527922688,1536069651,"Discover Coimbra and the Dão Wine Region through its delicious wines and pastries, and get to know one of the oldest Universities in the World... http://ow.ly/lxda50inITV  #TravelTuesday #winetour @visitportugal"
LUVDYWANG,1034062614525927428,1535374713,The Dao Ming siblings dancing to R. Kelly’s Ignition     hot and fresh out the kitchen mamma rollin’ that body   #MeteorGarden2018
DramaFeverG1,1034058547657461763,1535373744,"Ladies and gentlemen, the Dao Ming siblings!!!   #DaoMingSibs #DMZ #DMS #MeteorGarden2018"
licuende,1034055080419504132,1535372917,"Excited about the upcoming Permissions app on Aragon Core, which lets users fully configure their DAO and also be transparent about which entity or app has access to each resource in the DAO. Sneak peek here "
RTaylor05,1032276054759616512,1534948764,"Much to be desired in terms of understanding of the DAO vs Dash Core vs the great teams in Venezuela, but get seeing the successes highlighted in articles like this. "
remyers_,1031604392733093888,1534788628,"I think @bisq_network has a chance at being  one of the first practical DAOs and as you predict, it is an exchange. It's a very ambitious project, but it's also a serious attempt and we are sure to learn more from this project then we did from ""The DAO"". "
donnyandkisses,1030233065379885057,1534461678,"“Si Donny..” - Kisses when she saw the Dao Ming Siii standee  Hihi goodmorning, donny sii @donnypangilinan   #KissesLiveatUKG @delavinkisses"
Cointelegraph,1028929751984025600,1534150944,"Here’s how the SEC decisions correlated with market prices, from the DAO to the latest ETFs"
MeteorGardn2018,1025750099639513088,1533392855,Tonight at the Youth Mango Festival!  #MeteorGarden in the Dao Ming Si #DylanWang  and  Xi Men #CaesarWu  The two Men are handsome and handsome..  (1/1)    #MeteorGarden2018
DelRayMan,1024652545308995585,1533131178,"Six months after The DAO collapsed, Oliver Hart won the Nobel Prize for work that might have helped prevent the financial debacle: https://www.forbes.com/sites/michaeldelcastillo/2018/08/01/nobel-prize-winner-joins-blockchain-startup-to-fix-smart-contracts/#625faeca7cc7 … via @ForbesCrypto"
CardanoStiftung,1023926185481457665,1532958000,"IELE is a new virtual machine for the blockchain and its testnet is almost live! Lars Brunjes, Education Director at IOHK, explains the DAO Attack on Ethereum and how the same attack does not work in IELE. Watch the video here: "
InputOutputHK,1023913120534855681,1532954885,"Education Director @LarsBrunjes explains the DAO Attack on #Ethereum and shows that the same attack does not work in IELE, which has been designed from the ground up with security in mind. The IELE #testnet is almost live! Watch here: https://buff.ly/2mSf4l2  #Cardano @cardanocom"
daostack,1023306352356151298,1532810221,Alchemy is a tool for decentralized fund management and the first collaborative #dApp built on the #DAO stack:
_Kevin_Pham,1022660713020448768,1532656288,"High time preference activity:  Rolling back the DAO hack and degrading integrity of your blockchain forever.  Low time preference activity:  Allowing the Mt. Gox, Bitstamp, & Bitfinex hack to stand to force the Bitcoin ecosystem to become more resilient."
MeteorGardenCD,1020700350540480513,1532188901,"Appreciation post for #DylanWang   The amount of hate he got before for bagging the Dao Ming Si role was enormous but we love how he's getting all the love and appreciation now, not just for his face but also for his talents . You truly deserve it   #MeteorGarden2018"
VladZamfir,1020485667040702465,1532137717,Today is the DAO hard fork's second birthday!!  
MeteorGardn2018,1017080303557332992,1531325815,"#ShanChai & #DaoMingSi The trapped elevator, the Dao Ming Temple mischievous heart.. Want to kiss the cedar, but directly fainted because of cold, how do they spend the night of the elevator?  #MeteorGarden2018"
AASAsianStudies,1016759061059194880,1531249225,".@TelAvivUni faculty & AAS Member Ori Sela is author of a new @ColumbiaUP book, CHINA'S PHILOLOGICAL TURN: SCHOLARS, TEXTUALISM, AND THE DAO IN THE EIGHTEENTH CENTURY. https://buff.ly/2m5J6kZ "
notgrubles,1015634870402473985,1530981197,In case you didn’t get the reference. Vitalik tried ordering exchanges to stop trading after the DAO contract was executed.   Now he’s telling them to burn in hell because they’re centralized.  Except he was dictating orders to them when his project was in jeopardy.   coin. 
TalaoDAO,1015161446706155520,1530868324,"@TalaoDAO is the first Middlemen free marketplace ! Join the DAO dedicated to 100 millions of #freelancers. Check out our #ICO, it's here : https://buff.ly/2tz1Xvn  #blockchain #ethereum #marketplace #freelancer #ondemand #token"
Peacef_Warrior,1014517658237038592,1530714833,In a joint operation by Assam Rifles and the Dao Division of the Indian Army they have destroyed 3 camps of the Naga insurgent group NSCN (IM) in Motongsa village of Arunachal Pradesh.
DigitalLawrence,1014337990284283905,1530671997,"The story behind Ethereum and Ethereum Classic...  Very interesting read #theDAO Stay educated, stay ahead  $ETC & $ETH"
TheCuyahogaKid,1013213389210857472,1530403871,"""我们坚决反对任何国家与台湾开展任何形式的官方往来和军事联系"". The lack of tangible consequences for Starlight shows this is probably empty rhetoric. Maybe the DAO in Beijing gets the silent treatment for a while."
BioMarkDarrah,1012533848293310464,1530241856,Make a sample in twine or in the DAO toolset. Interactive writing is different than normal writing https://twitter.com/pentaghaasts/status/1012533581258911745 …
VitalikButerin,1011240057737568256,1529933392,"Umm, no it's not that simple. We've been through this in the DAO soft fork. It didn't work."
ZeppelinOrg,1008905199736508417,1529376718,"2 years ago, the DAO was hacked and we learned the importance of security in smart contract development the hard way. We created #OpenZeppelin to fill this gap"
CharlieShrem,1008827912701841408,1529358292,Hey I’m not criticizing the tech at all. My point was that EOS is forgoing immutability and creating a bad precedent like ethereum did during the DAO hack. What happens when a state wants to censor a tx? I thought the point of Blockchains is that so *no one* could have the power.
eric_lombrozo,1008779913912938496,1529346848,"The DAO hack was not a ""hindsight is 20/20"" situation. It was a ""foresight is 20/20"" situation.  People were explicitly warned, they were flippant with their money, they went ahead with it, they fucked it up, and then they dragging the rest of stakeholders into the mess."
JMT_Blockchain,1006809341805191169,1528877027,【对ETC上线Coinbase反应的众生相】以太坊经典排名加密货币前20位。其历史可以追溯到2016年以及the DAO的崩溃。the DAO是一种基于以太坊的融资项目，之后则因为一个代码漏洞而分崩离析了。
BTCsos_com,1006772754031538176,1528868304,#头条# 比特帮BTCside -【沉寂已久的ETC突然大涨，团队改变策略后能否追上ETH？】2016年著名的以太坊TheDAO事件，直接导致黑客盗走了近6000万美金的以太币，这件事跟门头沟一同被评为是区块... https://www.btcside.com/?p=44698 
daoxorg,1006618592862003200,1528831549,Hack the DAO: Blockchain Startup Daox to Announce a $100K Hacking Contest https://dollardestruction.com/6585/  via @DollarDestruct
giacomozucco,1006499488003952642,1528803152,"Since ""code is law"" based on TheDAO's TOS, that guy was not an ""hacker"". He was, strictly speaking, a very skilled ""lawyer"". "
pyskell,1006393198615416832,1528777811,Rewriting history here. If you want a fact-based unbiased history of The DAO you can check it out here:  https://github.com/ethereumbook/ethereumbook/blob/develop/forks-history.asciidoc …  Quite frankly there was heavy division in the community. There was no coming together. Many acquiesced.  Try to buidl rather than destroyl. Thanks.
daostack,1005931519976722432,1528667738,"#Governance and interoperability are two key challenges in #blockchain technology, according to @HyperLedger's executive director @brianbehlendorf. The #DAO stack aims to help solve both with a common framework for DAOs."
daostack,1004092545104637952,1528229292,"""I see a future where #governance is largely and highly automated, transparent, incorruptible... [#blockchain] could save humanity from the worst of our excesses."" @chithart looks into the future and at the challenges that the #DAO stack can help solve."
octafluoride,999991221694156800,1527251460,Every now and then I wonder how is the DAO meteor baby doing. If the Kents survives the 5th blight then Superboy should be 14 by the end of Trespassers
