user,tweetid,timestamp,content
dakami,745618013576015872,1466604162,"Basically, if you *actually* want Ethereum, and the DAO, to exist -- you should give them cover and time to fix their ship and make it float"
CryptoCobain,745585076604379137,1466596309,"the DAO attacker put ether into the whitehat attack, corrupted the whitehat attack, and can now split attack both the whitehat daos. LOL!"
ActualAdviceBTC,745574118775349248,1466593696,"After the DAO got attacked, it got whitehat counterattacked. So now, of course, the OG attacker counters and so on. https://np.reddit.com/r/ethereum/comments/4p9z93/it_seems_attacker_just_targeted_the_whitehatdaos/ …"
myetherwallet,745569367958523905,1466592563,"Time for that Soft Fork NOW ""The attacker is on the move again...joined both whitehat splits"" - @LefterisJP #thedao "
The_DAO_Project,745535077963038720,1466584388,#TheDAO #doNOTsplit
simondlr,745531955244990464,1466583644,Getting close to finishing a document on Solidity best practices post #theDAO hack. Will open source soon and wiki-fy it. #ethereum
marshawright,745524787145912324,1466581935,Will The $50m Heist Of The DAO Take Down Bitcoin's Rival Blo... http://bit.ly/28Q68Y1  #entrepreneur #startup
joincolony,745503841244741632,1466576941,Ethereum developers launch white hat counter-attack on TheDAO http://ow.ly/zNYT301vz73  #ethereum #thedao #blockchain
kristovatlas,745473285731672064,1466569656,"I really enjoyed @el33th4xor's talk on security and incentive flaws with The DAO. Great discussion from other meetup participants, also."
Melt_Dem,745410747744796672,1466554745,"""the DAO was effectively a $220M bug bounty on @ethereumproject solidity programming language"" @el33th4xor - why failure isn't always bad"
TuurDemeester,745410148106043393,1466554603,I can only imagine how this stuff will be debated in a court somewhere.       #TheDAO #Ethereum
TuurDemeester,745407587164786688,1466553992,"Breaking: Ethereum lead designer reports on ""white hat"" #TheDAO attacks  — 7M $ETH ($95M) drained/secured from fund. http://ow.ly/riQ1301vbzL "
jackfru1t,745403859950960641,1466553103,MUST READ: Race to drain the DAO  NEW: All $eth from DAO can be retrieved via soft fork only for full 1:100 refund.  https://www.reddit.com/r/ethereum/comments/4p7mhc/update_on_the_white_hat_attack/ …
TuurDemeester,745403045391917057,1466552909,I think we're moving much higher with #Bitcoin. The DAO drama was a BTC boon; it highlighted Bitcoin's qualities. 
The_DAO_Project,745402417093709824,1466552759,Very thorough update on the #WhiteHatAttack #theDAO #Ethereum @reddit
The_DAO_Project,745395133571440641,1466551023,#TheDAO #WhiteHatHack
The_DAO_Project,745392392249946112,1466550369,#WhiteHatHack #TheDAO has been successful! Please do NOT SPLIT anymore #ethereum #TheDAOhack @DAOhubORG
feindura,745392071645728768,1466550293,80% of the #DAO ether is safe for now. And there is a way to attack the attacker and get all money back! Watch out https://etherscan.io/address/0xf35e2cc8e6523d683ed44870f5b7cc785051a77d …!
ErikVoorhees,745388249108086784,1466549381,"Regardless of what happens with @The_DAO_Project, the fiasco has drawn immense critique upon #Ethereum security, which will thus improve."
MrChrisEllis,745339932944773121,1466537862,"An apology from Christoph Jentzsch, CTO of Slock.it for not spotting the bug in #theDAO "
vessenes,745338574225182721,1466537538,I am going to put this out there: if the whitehat #TheDAO attack isn't sending to a refund wallet there's gonna be problems
coindesk,745337367276429312,1466537250,Ethereum Developers Launch White Hat Counter-Attack on The DAO http://www.coindesk.com/ethereum-developers-draining-dao …
stephantual,745328448063811585,1466535124,Ongoing white hat attack doesn't preclude soft or hardforks in the future - both are still desired - #thedao #ethereum #blockchain
feindura,745322649044262912,1466533741,The DAO gets drained to a safe place! This is a white hat attack!  The money is saved here:  https://etherscan.io/address/0xb136707642a4ea12fb4bae820f03d2562ebff487 …
stephantual,745322581620834304,1466533725,Note: Community-led team is currently coordinating a white-hat attack on The DAO in order to prevent further attacks 
avsa,745318197876953088,1466532680,I repeat. There was an attack on the DAO so we launched our white hat counter attack. More updates will follow
LefterisJP,745313786031124480,1466531628,There is a white-hat attack going on #TheDAO right now in order to put the funds in a more controlled environment. DTH do not panic.
BitcoinMagazine,745274899120328704,1466522357,"""The DAO was not hacked. It simply executed its code, and by doing so, it went bankrupt."" - @Steveinpursuit"
stephantual,745266421349900292,1466520335,Miners & Mining Pools with 'yes' votes - note that the Parity client has already merged the softfork - https://ethcore.io/parity.html  #thedao
VitalikButerin,745263426318983176,1466519621,"Thanks a lot to @el33th4xor, @phildaian and others for all their hard work on the DAO situation and ethereum smart contract security."
el33th4xor,745231124583026688,1466511920,"If the ETH community bails out the DAO (and I believe they should), we need to put in place a social wall around Slockit to avoid a repeat."
redtheminer,745186202337173504,1466501210,从技术角度剖析针对 #theDAO 的攻击手法 by #Shanghai Stock Exchange official: http://www.8btc.com/the-dao-attack  #ethereum
redtheminer,745177374673645569,1466499105,The #DAO 的漏洞利用分析 Analysis of the DAO exploit http://www.8btc.com/thedao-expolit-analysis … @phildaian #ethereum
leashless,745169119545176064,1466497137,#TheDAO has far worse problems than the 55 million missing https://www.reddit.com/r/ethereum/comments/4p3jsu/google_jointly_and_severally_the_dao_and_read/ … the contagion of legal liability seems even more sticky.
EdanYago,745166903853776896,1466496609,Coindesk republishes my initial reaction to the DAO & forking.  http://bit.ly/28IWW4p  via @CoinDesk
aantonop,745099591805181952,1466480560,"IBTimes on theDAO, theFork and theFallout show:"
VitalikButerin,745085859230167041,1466477286,We’ve had many reqs from community for updates on the DAO situation.  We are continuing to discuss internally and move fwd with solutions.
ofnumbers,745065731868393472,1466472487,"Wait, how is it @el33th4xor's fault that #TheDAO  team did inadequate due diligence and testing for vulnerabilities? "
taoeffect,745064493747560448,1466472192,Proposal: Overriding Smart Contracts Through Opt-In Voting https://fixingtao.com/2016/06/proposal-overriding-smart-contracts-through-opt-in-voting/ … #Ethereum #TheDAO
TuurDemeester,745045775449677824,1466467729,This kind of horrible leadership at #TheDAO reflects badly on the #Ethereum core devs who endorsed the project.
muneeb,745037445373304832,1466465743,"The DAO brought a bug bounty to Ethereum. Now, security exploits are lining up. Latest one publicized by @phildaian https://blog.blockstack.org/solar-storm-a-serious-security-exploit-with-ethereum-not-just-the-dao-a03d797d98fa#.ebvrwm6gq …"
el33th4xor,745032006317252614,1466464446,"I love this community. And for the record, I'm not the DAO h4x0r. Now excuse me as I lambo out of here. https://twitter.com/NakedCharts_FX/status/745030898387722241 …"
hughlang,745030164158025729,1466464007,"#THEDAO: Watching the 5 stages of grief unfold (denial, anger, bargaining, depression & acceptance). Now at stages 2-3. Waiting for 4 & 5."
SDLerner,745024752453050369,1466462717,Recommended reading: C. Hoskinson's take on #TheDAO. https://hoskinsoncharles.blogspot.com.ar/2016/06/some-history-some-musings-and-my-take.html … #ethereum
el33th4xor,745021841840963584,1466462023,"In almost every community, people who abuse a community's good will get a ban&downtime to learn from their mistakes. #TheDAO team needs it."
jackfru1t,745018075720912896,1466461125,The leadership of the DAO/Slockit has been one of the worst aspects of this mess. Finger pointing even now. 
stephantual,745013737074081792,1466460091,.@el33th4xor was aware of exploit but didn't inform the DAO security group he joined on 5/31 #theDAO 
coindesk,744983223067906048,1466452816,Forbes – The DAO Hacking Shows That Coders Are Not Infallible http://www.forbes.com/sites/francescoppola/2016/06/20/the-dao-hacking-shows-that-coders-are-not-infallible/#5ea3ca0e125d … by @Frances_Coppola
BitcoinMagazine,744979789002444800,1466451997,The #DAO Was Not Hacked | Mt. Gox 2.0 by @steveinpursuit http://btcm.ag/daoha 
stephantual,744939754865762304,1466442452,The DAO Attack: Who’s To Blame?  - https://blog.simpleblend.net/dao-attack-whos-blame/ … by Andrew Robbins
stephantual,744913458353836032,1466436182,Soft fork looking very promising on all pools. http://ethpool.org/stats/votes  #thedao #ethereum #blockchain
el33th4xor,744893018780635136,1466431309,"I'm doing a MeetUp on The DAO tomorrow in NYC. Frank discussion on DAO, eth, Slockit, smart contracts. Come join: "
trentmc0,744879730529341440,1466428141,".@gavofyork on options for TheDAO. Emphasizing it's about the whole community, by design #dbc16."
trentmc0,744879180177903616,1466428010,".@gavofyork ""here's basically what happened to The DAO. BTW nothing happened to Ethereum [network]."" #dbc16"
gmcmullen,744865302173917184,1466424701,Constitutional Code & Blockchain Neutrality: Lessons in governance from #TheDAO https://medium.com/ipdb-blog/constitutional-code-blockchain-neutrality-26c8b359e542#.iurek78j0 … #ethereum #DAOhack
KapplerKen,744859435605106688,1466423302,With all this attention focused on #theDAO let's not lose sight of the cool stuff that is incoming. #Parity #Ethcore
bortzmeyer,744801170414174208,1466409411,"The DAO, Ethereum, et l'attaque de juin 2016 http://www.bortzmeyer.org/the-dao-ethereum-et-une-attaque.html …"
sthenc,744751241536774144,1466397507,"Regardless of how the DAO / ETH situation plays out, *major* props to @VitalikButerin for this mentality  "
AkioHoshi,744735842833358848,1466393836,MIT Media Lab松尾氏のポスト。The DAOの事件を受け、ブロックチェーン分野でも暗号プロトコルの形式検証を始めアカデミアの知識を共有すべきと指摘。 / “多様な信頼点による非中央集権の実現 — サイエンスによる支援…” 
aionescu,744724438281752576,1466391117,"Romanians. Invent a technology, and they'll find a way to... maximize its potential for personal gain ;-) #TheDAO #TheDaoHack"
WayneVaughan,744707661715935232,1466387117,The DAO attacker is trying to block a hardfork with a smart contract botnet. Plot thickens. http://pastebin.com/9MRVDC9h 
bcrypt,744702354843262977,1466385851,Game of Transactions. #TheDAO
CryptOrca,744696049076428800,1466384348,$ETH killer app ... #TheDAO
masanork,744692699798732800,1466383550,金曜日に発覚したThe DAOからのEther流出について解説しました。MtGOX事件以上に暗号通貨の未来に与える示唆は大きいかも知れませんね / “セキュリティ・ホットトピックス - 暗号通貨ファンド「The DAO」から数十…” 
cdixon,744683711870836738,1466381407,The Path to Learning requires Failing: The DAO http://continuations.com/post/146127873170/the-path-to-learning-requires-failing-the-dao …
nolimitsecu,744657493100470272,1466375156,#Podcast  @bmalaus nous parle de l'attaque en cours sur #TheDAO  https://www.nolimitsecu.fr/attaque-sur-la-dao/ …  #blockchain #ethereum
leashless,744652899574231041,1466374060,"Thoughts on #theDAO https://www.youtube.com/watch?v=DLmn0d4gQA8 … I'm starting to consider my position, in public, on what should be done. Hope this is useful!"
paulsbohm,744629839789842432,1466368563,The DAO that can be drained is not the true DAO.
muneeb,744616361012375553,1466365349,"Great 2nd post by @phildaian on the DAO attack, exposes Solidity bug https://pdaian.com/blog/chasing-the-dao-attackers-wake/ …"
koeppelmann,744614480991162368,1466364901,Good news for #theDAO token holders. It seems like we can counter attack and restore all ETH with only soft-fork(s): https://blog.slock.it/a-dao-counter-attack-613548408dd7#.p9495xnwy …
ModernApostate,744597125758017536,1466360763,Spread the word: @aantonop did NOT say #ethereum is a failed experiment #bitcoin #TheDAO  https://twitter.com/aantonop/status/744593458116034560 …
slockitproject,744596460885401600,1466360604,DAO Counter Attack - https://blog.slock.it/a-dao-counter-attack-613548408dd7#.c2nmoe60a … #thedao #ethereum #blockchain
starkness,744591607073169408,1466359447,"Any sufficiently complex set of code will have bugs, and smart contracts are in no way immune. #TheDAO "
phildaian,744585671822671876,1466358032,New post with some more misc. thoughts on the DAO hack https://pdaian.com/blog/chasing-the-dao-attackers-wake/ … (yes I will fix my SSL at some point... damn StartCom)
ethereumreport,744583251507871744,1466357455,Second Assailant Drains Ethereum Funds From The DAO 
kristovatlas,744578922554265601,1466356423,"""When TheDAO 2.0 comes along it needs to receive auditing before everyone goes and dumps a $100m on it."" "
izakaminska,744575491328335872,1466355605,The DAO attacker wants to teach the community a due diligence lesson by making them take a 30% haircut on holdings 
thegrugq,744571079407001600,1466354553,"The DAO is being attacked again, by another attacker(?) and I can’t stop laughing  https://www.reddit.com/r/ethereum/comments/4ot3z8/dao_is_under_attack_again/ …"
isislovecruft,744571027028582400,1466354540,"""OMG, LIGHTBULB. Let's not just DDoS our own network. LET'S ACTIVELY ATTACK THE DAO TO SECURE THE REMAINING $100M."" "
Excellion,744566561403330560,1466353476,The DAO is a bundle of fireworks strapped to that ETH go-cart.
The_DAO_Project,744563767032307713,1466352810,Plan for action #TheDAO #whatthehack  @slockitproject @LefterisJP #ethereum
LefterisJP,744562551162286084,1466352520,A way for #TheDAO to stop the attacker&copycats from ever seeing any Ether out of their theft #ethereum https://blog.slock.it/a-dao-counter-attack-613548408dd7#.csl582o8m … #TheDaoHack
yaoeo,744552396114780160,1466350099,"Nice overview of #theDAO hack, the problems it raised and the solutions at hands by @davidsiegel: https://medium.com/@pullnews/understanding-the-dao-hack-for-journalists-2312dd43e993#.lveycya6d …"
phildaian,744548942684237824,1466349275,New bombshell last night from @joeykrug447: the recursive send attack was NOT the only exploit that could have emptied the DAO.
el33th4xor,744538425282469888,1466346768,"I have to say, calling this specific contract ""The DAO"" was quite presumptive. It usurped the word, and now ended up tarnishing it."
el33th4xor,744537763760975872,1466346610,Nice overview of the accounts involved in The DAO exploit: 
The_DAO_Project,744520970908614656,1466342606,#TheDaoHack #TheDAO Thank you @gavofyork #ethereum #blockchain
gavofyork,744511005103882240,1466340230,Formally-defined injustice is still injustice. #ethereum #TheDAO #TheDaoHack
urawazakun,744480131754819584,1466332869,俺ら「theDAOの金庫がやられたぞー！」  ニュース「えーっと、イーサリアムの不備で暗号通貨が50億ほど盗まれたようです」 俺ら「ちゃうちゃうtheDAOの不備や」 ニュ「えっと、theDAOが50億盗まれて」 俺ら「盗まれたのはETHや」
koeppelmann,744416626980823040,1466317729,The big #theDAO heist FAQ: https://www.reddit.com/r/ethereum/comments/4os7l5/the_big_thedao_heist_faq/ … - please ask questions if something is missing.
VitalikButerin,744413251350331393,1466316924,So it looks like the DAO attack bumped up the gas limit enough as a side effect to unstuck the coins in governmental http://etherscan.io/tx/0x0d80d67202bd9cb6773df8dd2020e7190a1b0793e8ec4fc105257e8128f0506b …
aantonop,744346778867277824,1466301076,LTB Live - TheDAO TheFork TheFallout: http://youtu.be/RHcLKrkwPLQ?a  via @YouTube
aantonop,744338668869947392,1466299142,Thanks to my guests @pamelawjd @brianeklein @TaylorGerring for their fantastic contributions on theDAO show. Follow them for more insights!
aantonop,744336298429669376,1466298577,"All 2:15 hrs of theDAO, theFork, theFallout, our live LTB show from today:"
weihuibao,744333266790998016,1466297854,热点文章：《THE DAO攻击者公开信：我获得的以太币是合法并正当的》 http://wehuibao.com/docq/555799 
albertwenger,744304361501822976,1466290962,The Path to Learning requires Failing: The DAO - We learn more from our failures ... 
leashless,744297970296840192,1466289439,"Uncomfortable feeling people expect me to pull a rabbit out of a hat on #theDAO  What do I look like, Fat Gandalf?   https://youtu.be/TFXlWfzW9Uo "
aantonop,744296267736547328,1466289033,"LTB Live: TheDAO, TheFork, TheFallout"
TuurDemeester,744294531286241281,1466288619,I feel angry seeing #TheDAO spokesman laugh as he talks about hack & potentially losing $50-$100M for his investors. 
aantonop,744291412456448000,1466287875,"Standby for link. TheDAO, TheFork, TheFallout - Live LTB show with guest @pamelawjd and others in 5 min or so"
aantonop,744281779721355264,1466285579,"This episode of LTB, on theDAO,  will be recorded and broadcast live with Q&A. Standby for live URL in 30 min. DM me for guest invitation."
coindesk,744258547853201408,1466280040,Can whoever hacked The DAO be held criminally or civilly liable? @palleylaw gives his take:
twobitidiot,744248120578555904,1466277554,"The DAO, much like Mt. Gox, had red flags all over the place. Bulls make money, bears make money, pigs get slaughtered."
The_DAO_Project,744243286655762432,1466276401,“What the ‘Fork’ Really Means” by @ChrJentzsch
aantonop,744240106832338944,1466275643,"The message from the DAO ""Attacker"" was signed. Has anyone worked out what key was used to sign? I haven't had a chance yet..."
monaxHQ,744238008187002886,1466275143,New on the Eng: Lessons on Preparation for Disaster from the DAO  http://zpr.io/uneX 
aantonop,744232061377122304,1466273725,"If the person who drained the DAO wants to do an interview, I can offer voice-masking and anonymity. Contact me via http://antonopoulos.com "
SwiftOnSecurity,744226462161473536,1466272390,tfw you realize the dao hack is imaginary money reporters just slapped a value on to make it sound important
stephantual,744224656127893504,1466271959,A Fork in the Road — big decisions ahead - https://blog.slock.it/a-fork-in-the-road-c3c267b9ff31#.z1zguo979 … #ethereum #thedao #blockchain
Joi,744221223001923584,1466271141,"Interesting open letter from ""The Attacker"" of The DAO http://pastebin.com/CcGUBgDG "
ButtCoin,744207120308961281,1466267778,"The DAO hacker posted a letter to pastebin that, according to libertarian ideals, he was entitled to all the money. http://pastebin.com/CcGUBgDG "
CojeeMobile,744204804507865088,1466267226,THE DAOの資産流出事件を受けて、スマートコントラクトやDAOが採用すべきシステム戦略の案を記事に書きました。もう夜中ですが眠れない人ぜひ・・ http://open-process.jp/home/?p=1377 　#IoV #DAO
peterktodd,744202403747078144,1466266654,"I think a lot of the schadenfreude is being directed against the DAO's creators, who many regard as fraudsters. https://twitter.com/nathanhawkeye/status/743996381388386304 …"
DelRayMan,744201104490106880,1466266344,The collapse of The DAO directly impacts 52 projects awaiting review. http://bit.ly/263O2Kl  via @coindesk
coindesk,744200123496955904,1466266110,The DAO: An Analysis of the Fallout http://www.coindesk.com/the-dao-an-analysis-of-the-fallout …
wences,744194298531418112,1466264721,Best article I have read about the DAO hack: http://www.bloomberg.com/view/articles/2016-06-17/blockchain-company-s-smart-contracts-were-dumb … via @matt_levine
cristalopes,744188812046176257,1466263413,"The ""DAO hack"" is a fascinating tale on many fronts, featuring PL design front and center http://hackingdistributed.com/2016/06/17/thoughts-on-the-dao-hack/ …"
TaylorGerring,744186601333366785,1466262886,"3/ Many options on the table for dealing with #TheDAO attackers, but choice is w/ community. Blockchains serve humans, not other way around"
matthew_d_green,744185148472692736,1466262540,I just want to say: it's awesome that @zooko and his LeastAuthority team found the DAO issue two years ago. Glad they're building @zcashco.
Excellion,744183914487373824,1466262246,5/ Have Roger Ver invest in The DAO. Bitcoin is driving away users b/c high tx fees. Sell his BTC and buy DAO Tokens. Win-win situation.
Excellion,744183760430587904,1466262209,4/ Bring on @Falkvinge to remove unnecessary code in The DAO. Obviously the problem is over-engineering. Delete. Delete. Delete.
Excellion,744183331189751808,1466262107,1/ I have a plan to save #TheDAO. This may sound crazy but bear with me. Sometimes the craziest plans are the ones that work.
musalbas,744175560520253441,1466260254,Excellent layman's explanation of the DAO attack. http://www.wired.com/2016/06/50-million-hack-just-showed-dao-human/ …
diiorioanthony,744167473679826944,1466258326,What happened with #thedao yesterday was not a theft. It was a crappy contract that executed as instructed. No one cheated. #ethereum
coindesk,744164954723520513,1466257725,Why The DAO Attack is Good for Ethereum http://www.coindesk.com/dao-attack-good-thing-ethereum …
polemitis,744155816882642945,1466255547,Legendary-level trolling by the DAO attacker https://steemit.com/ethereum/@chris4210/an-open-letter-to-the-dao-and-the-ethereum-community …
michael_nielsen,744154588824150020,1466255254,"When contracts are expressed by code, should ppl be upset when the code is used in unexpectd ways? On the DAO ""hack"" http://www.bloomberg.com/view/articles/2016-06-17/blockchain-company-s-smart-contracts-were-dumb …"
matthew_d_green,744151728958898181,1466254572,Good background post on Ethereum and the DAO by @ErrataRob. http://blog.erratasec.com/2016/06/etheriumdao-hack-similfied.html …
ActualAdviceBTC,744142177475821568,1466252295,The hacker is threatening to sue the DAO   what a time to be alive
slockitproject,744142080453263360,1466252272,THE FILTER #88 “Tough Day for The DAO” - https://www.youtube.com/watch?v=GvgTivwzcuo … #thedao #blockchain #ethereum
yaoeo,744126987535421441,1466248673,"If #theDAO was made of dumb smart contracts, perhaps artificial intelligence is the way to go? @trentmc0 on AI-DAOs:"
ErrataRob,744118466668539904,1466246642,I attempted to create a simple explanation of the Ethereum/TheDAO failure: http://blog.erratasec.com/2016/06/etheriumdao-hack-similfied.html …
ThomasBertani,744118307947712512,1466246604,"An open letter signed by ""the attacker"" #thedao #etherem http://pastebin.com/CcGUBgDG "
ldodds,744114238789148672,1466245634,"""the attacker is currently in the process of draining the ether contained in the DAO into a child DAO.."" like opening lines to a scifi novel"
yaoeo,744110060331241472,1466244637,Great analysis of #thedao exploit by @phildaian http://hackingdistributed.com/2016/06/18/analysis-of-the-dao-exploit/ …
stephantual,744108774584115200,1466244331,The Rise of the Dark DAO - the hunt begins - https://medium.com/@oaeee/the-rise-of-the-dark-dao-72b21a2212e3#.dpmxdk1gc … #ethereum #blockchain #theDAO 
The_DAO_Project,744107616104816640,1466244055,#TheDAO fights back! 
stephantual,744105948508266496,1466243657,#theDAO - Ethereum Geth client (99.99% of miners) start testing soft fork https://github.com/ethereum/go-ethereum/pull/2715 … #ethereum #blockchain
The_DAO_Project,744087865915768832,1466239346,“An Ethereum hard fork is not a bailout; it’s foiling a bank robbery.” by @joincolony
IOHK_Charles,744083839052455936,1466238386,Not like the DAO bug was known for several days or anything like that.... 
EdanYago,744072470613856256,1466235675,There is something far bigger than #theDao or even #ethereum at stake here: the very idea of immutable smart contracts.
Techmeme,744061112556060672,1466232967,"The ""theft"" of Ethereum from the DAO violated the DAO's intent, but not its smart contract http://www.bloomberg.com/view/articles/2016-06-17/blockchain-company-s-smart-contracts-were-dumb …"
AugurProject,744059812535734272,1466232657,Deconstructing theDAO Attack: A Brief Code Tour (w/ assistance from Augur's @joeykrug447): http://vessenes.com/deconstructing-thedao-attack-a-brief-code-tour … #ethereum #augur #TheDAO
el33th4xor,744048499868733440,1466229960,"Analysis of the DAO Exploit by Phil Daian, hacker extraordinaire & 1st year PhD student at Cornell. http://hackingdistributed.com/2016/06/18/analysis-of-the-dao-exploit/ … #ethereum"
zooko,744044852191576064,1466229091,"I like and trust Vitalik (disclosure: Zcash advisor), but IMHO the rollback plan is endangering Ethereum to rescue thedao investors."
vessenes,744044216184086531,1466228939,"#TheDAO and #ethereum folks -- a tour of theDAO attack code, and how it worked -- hot off the press. http://vessenes.com/deconstructing-thedao-attack-a-brief-code-tour/ …"
diiorioanthony,744027194737967105,1466224881,"#TheDAO is an #Ethereum app. As a significant holder of #DAO & #ETH, I can not support altering platform due to rogue app. Scary precedent."
binarybits,743981606575214592,1466214012,Brilliant @matt_levine post on the DAO and the relationship between algorithms and law. http://www.bloomberg.com/view/articles/2016-06-17/blockchain-company-s-smart-contracts-were-dumb …
jgarzik,743979368599293953,1466213478,"Highlighting. #TheDAO is app layer, not protocol layer. e.g. Would never fork #bitcoin due to a website theft."
tqbf,743960939016269824,1466209084,"Again, as someone who has not been following along:  I cannot believe “The DAO” was ever really a thing.  What are these people thinking!?"
